,Rank,Streams,Year,Country,Title,Artist
0,1,819501,2018,no,River (feat. Ed Sheeran), Eminem
1,2,617762,2018,no,Meant to Be (feat. Florida Georgia Line), Bebe Rexha
2,3,614391,2018,no,All Falls Down (feat. Juliander), Alan Walker
3,4,587588,2018,no,Him & I (with Halsey), G-Eazy
4,5,585403,2018,no,rockstar, Post Malone
5,6,527492,2018,no,Walls, Ruben
6,7,523422,2018,no,Strongest, Ina Wroldsen
7,8,516269,2018,no,Let You Down, NF
8,9,508184,2018,no,Home (with Machine Gun Kelly X Ambassadors & Bebe Rexha), Machine Gun Kelly
9,10,496077,2018,no,Rett i foret, Karpe
10,11,455490,2018,no,Perfect Duet (Ed Sheeran & Beyoncé), Ed Sheeran
11,12,445309,2018,no,Wolves, Selena Gomez
12,13,436259,2018,no,Échame La Culpa, Luis Fonsi
13,14,420100,2018,no,Perfect, Ed Sheeran
14,15,411841,2018,no,So Far Away (feat. Jamie Scott & Romy Dya), Martin Garrix
15,16,405108,2018,no,Stargazing, Kygo
16,17,389435,2018,no,I Miss You (feat. Julia Michaels), Clean Bandit
17,18,374522,2018,no,Silence, Marshmello
18,19,355574,2018,no,This Town (feat. Sasha Alex Sloan), Kygo
19,20,348364,2018,no,Havana (feat. Young Thug), Camila Cabello
20,21,330020,2018,no,Dreamer, Axwell /\ Ingrosso
21,22,327536,2018,no,Feel It Still, Portugal. The Man
22,23,325102,2018,no,Dusk Till Dawn (feat. Sia) - Radio Edit, ZAYN
23,24,324336,2018,no,What Lovers Do (feat. SZA), Maroon 5
24,25,323585,2018,no,All The Stars (with SZA), Kendrick Lamar
25,26,321140,2018,no,In My Head, Sophie Elise
26,27,316536,2018,no,Think Before I Talk, Astrid S
27,28,315035,2018,no,For You (Fifty Shades Freed) (& Rita Ora), Liam Payne
28,29,303023,2018,no,Cruel World, Seeb
29,30,299887,2018,no,Incapable, Julie Bergan
30,31,286114,2018,no,Finesse - Remix; feat. Cardi B, Bruno Mars
31,32,280515,2018,no,The Spectre, Alan Walker
32,33,267467,2018,no,Man's Not Hot, Big Shaq
33,34,266414,2018,no,I Fall Apart, Post Malone
34,35,258171,2018,no,Too Good At Good,es  
35,36,257495,2018,no,New Rules, Dua Lipa
36,37,254428,2018,no,Candy Paint, Post Malone
37,38,249488,2018,no,Let Me Go (with Alesso Florida Georgia Line & watt), Hailee Steinfeld
38,39,246867,2018,no,Filthy, Justin Timberlake
39,40,233840,2018,no,Shape of You, Ed Sheeran
40,41,222878,2018,no,Slow (feat. Noah Cyrus), Matoma
41,42,214983,2018,no,Never Be the Same, Camila Cabello
42,43,214561,2018,no,Strangers, Sigrid
43,44,212942,2018,no,1-800-273-8255, Logic
44,45,211689,2018,no,Rich Love (with Seeb), OneRepublic
45,46,205838,2018,no,Om 100 år er allting glemt (feat. Lothepus), Staysman & Lazz
46,47,204909,2018,no,Gucci Gang, Lil Pump
47,48,204369,2018,no,Pumped Up, Klingande
48,49,204161,2018,no,Despacito - Remix, Luis Fonsi
49,50,200761,2018,no,Bartier Cardi (feat. 21 Savage), Cardi B
50,51,170326,2018,no,Unforgettable, French Montana
51,52,163031,2018,no,Anywhere, Rita Ora
52,53,162256,2018,no,Lonely Together (feat. Rita Ora), Avicii
53,54,157512,2018,no,No Limit, G-Eazy
54,55,153451,2018,no,Thunder, Imagine Dragons
55,56,151712,2018,no,Naked, James Arthur
56,57,151177,2018,no,It Ain't Me (with Selena Gomez), Kygo
57,58,145066,2018,no,Slow Me Down (feat. Skinny Days), CLMD
58,59,145056,2018,no,Go Flex, Post Malone
59,60,144984,2018,no,XO Tour Llif3, Lil Uzi Vert
60,61,144575,2018,no,Such A Boy, Astrid S
61,62,144126,2018,no,I Like Me Better, Lauv
62,63,141894,2018,no,More Than You Know, Axwell /\ Ingrosso
63,64,141741,2018,no,Congratulations, Post Malone
64,65,139796,2018,no,Fy Faen, Hkeem
65,66,139453,2018,no,Jocelyn Flores, XXXTENTACION
66,67,137451,2018,no,Summer Air, ItaloBrothers
67,68,135567,2018,no,Håper du har plass, Cezinando
68,69,132184,2018,no,Without You (feat. Sandro Cavazza), Avicii
69,70,130011,2018,no,Dive With Me, LVNDSCAPE
70,71,126608,2018,no,When You Love Someone, James TW
71,72,122694,2018,no,Er dette alt (feat. Chirag), Cezinando
72,73,121557,2018,no,Symphony (feat. Zara Larsson), Clean Bandit
73,74,121422,2018,no,Something Just Like This, The Chainsmokers
74,75,120569,2018,no,Tuesday, Burak Yeter
75,76,119880,2018,no,Young Dumb & Broke, Khalid
76,77,119518,2018,no,HUMBLE., Kendrick Lamar
77,78,119455,2018,no,I Know You, Craig David
78,79,117196,2018,no,Cool With It, Alida
79,80,116802,2018,no,Believer, Imagine Dragons
80,81,115616,2018,no,Real Friends, Camila Cabello
81,82,115407,2018,no,BBB, Arif
82,83,114242,2018,no,Vi er perfekt men verden er ikke det, Astrid S
83,84,111983,2018,no,Only Human, Joakim Lundell
84,85,111542,2018,no,Issues, Julia Michaels
85,86,110235,2018,no,One Night Stand, Vidar Villa
86,87,109731,2018,no,Stay Young, Mike Perry
87,88,109551,2018,no,Alene, Arif
88,89,107127,2018,no,How Long, Charlie Puth
89,90,106598,2018,no,Feels (feat. Pharrell Williams Katy Perry & Big Sean), Calvin Harris
90,91,102670,2018,no,Say You Won't Let Go, James Arthur
91,92,102545,2018,no,Strongest (Alan Walker Remix), Ina Wroldsen
92,93,101906,2018,no,First Time, Kygo
93,94,101800,2018,no,Glorious (feat. Skylar Grey), Macklemore
94,95,101486,2018,no,Dancing On My Own, Calum Scott
95,96,101430,2018,no,Ingenting blir det samme men samme for meg, Cezinando
96,97,101430,2018,no,Galway Girl, Ed Sheeran
97,98,101274,2018,no,Tired, Alan Walker
98,99,101042,2018,no,Dup-i-dup, Karpe
99,100,100964,2018,no,Attention, Charlie Puth
100,101,99837,2018,no,Breathe, Jax Jones
101,102,99623,2018,no,Walk On Water (feat. Beyoncé), Eminem
102,103,99547,2018,no,What About Us, P!nk
103,104,98297,2018,no,Coming Up (feat. Victor Crone), Tungevaag
104,105,97058,2018,no,Everglow, Coldplay
105,106,96616,2018,no,Mi Gente, J Balvin
106,107,95539,2018,no,Bank Account, 21 Savage
107,108,95039,2018,no,Ric Flair Drip (with Metro Boomin), Offset
108,109,94229,2018,no,Friends (with BloodPop®), Justin Bieber
109,110,93932,2018,no,The Other, Lauv
110,111,93241,2018,no,Plain Jane, A$AP Ferg
111,112,92569,2018,no,"I Don’t Wanna Live Forever (Fifty Shades Darker) - From ""Fifty Shades Darker (Original Motion Picture Soundtrack)""", ZAYN
112,113,92514,2018,no,OK, Robin Schulz
113,114,92141,2018,no,Tip Toe (feat. French Montana), Jason Derulo
114,115,91426,2018,no,Sorry Not Sorry, Demi Lovato
115,116,91085,2018,no,Faded, Alan Walker
116,117,90444,2018,no,"How Far I'll Go - From ""Moana""", Alessia Cara
117,118,90423,2018,no,Happier, Ed Sheeran
118,119,89674,2018,no,When We Were Young, Adele
119,120,89401,2018,no,Don't Kill My Vibe, Sigrid
120,121,88968,2018,no,Bodak Yellow, Cardi B
121,122,88771,2018,no,I Feel It Coming, The Weeknd
122,123,88493,2018,no,Kids in Love (feat. The Night Game), Kygo
123,124,88361,2018,no,Scared to Be Lonely, Martin Garrix
124,125,88294,2018,no,Skin, Rag'n'Bone Man
125,126,87854,2018,no,Betrayed, Lil Xan
126,127,87376,2018,no,Youth, Daughter
127,128,87294,2018,no,Sober, G-Eazy
128,129,86982,2018,no,White Iverson, Post Malone
129,130,86677,2018,no,Pretty Girl - Cheat Codes X CADE Remix, Maggie Lindemann
130,131,86079,2018,no,Fireproof (feat. Teddy Sky), VAX
131,132,86077,2018,no,Solo Dance, Martin Jensen
132,133,85608,2018,no,Photograph, Ed Sheeran
133,134,85199,2018,no,The Sound of Silence, Disturbed
134,135,84993,2018,no,Urettferdig, Hkeem
135,136,84215,2018,no,Jovial, Freddy Kalas
136,137,83734,2018,no,Bare så du vett det, Stavangerkameratene
137,138,83442,2018,no,Mask Off, Future
138,139,83180,2018,no,Mama, Jonas Blue
139,140,82366,2018,no,Hearts Ain't Gonna Lie (with Jonas Blue), Arlissa
140,141,82070,2018,no,Broken People (with Logic & Rag'n'Bone Man), Logic
141,142,81794,2018,no,Spis din syvende sans, Karpe
142,143,81695,2018,no,Alone, Alan Walker
143,144,81261,2018,no,Ulovlig, TIX
144,145,80858,2018,no,Then, Anne-Marie
145,146,80555,2018,no,MEXICO, Chris Holsten
146,147,80206,2018,no,Sign of the Times, Harry Styles
147,148,80154,2018,no,Back to You (feat. Bebe Rexha & Digital Farm Animals), Louis Tomlinson
148,149,78851,2018,no,Nowhere Fast (feat. Kehlani), Eminem
149,150,78193,2018,no,I Believe I'm Fine, Robin Schulz
150,151,77089,2018,no,Love You Like That, Dagny
151,152,76935,2018,no,Despacito (Featuring Daddy Yankee), Luis Fonsi
152,153,76709,2018,no,I Can't Fall in Love Without You, Zara Larsson
153,154,76128,2018,no,Castle on the Hill, Ed Sheeran
154,155,75986,2018,no,Thinking out Loud, Ed Sheeran
155,156,75787,2018,no,The Night We Met, Lord Huron
156,157,75418,2018,no,Wait, Martin Jensen
157,158,75081,2018,no,Jealous, Labrinth
158,159,74988,2018,no,Codeine Dreaming (feat. Lil Wayne), Kodak Black
159,160,74213,2018,no,Snowman, Sia
160,161,73871,2018,no,Sulten 2 (Live på NRK P3), Karpe
161,162,73856,2018,no,"Lose Yourself - From ""8 Mile"" Soundtrack", Eminem
162,163,73370,2018,no,Too Much To Ask, Niall Horan
163,164,73280,2018,no,It's Gotta Be You, Isaiah Firebrace
164,165,73012,2018,no,2U (feat. Justin Bieber), David Guetta
165,166,72907,2018,no,Bade naken, Plumbo
166,167,72298,2018,no,Bængshot, Linda Vidala
167,168,72062,2018,no,BUTTERFLY EFFECT, Travis Scott
168,169,71456,2018,no,Rocka,e (feat. Sean Paul & Anne-Marie)  
169,170,71441,2018,no,For You, James TW
170,171,71087,2018,no,Lett å være rebell i kjellerleiligheten din, Karpe
171,172,70863,2018,no,Oceans, JCY
172,173,70226,2018,no,Let It Go, James Bay
173,174,69961,2018,no,Dirty Sexy Money (feat. Charli XCX & French Montana), David Guetta
174,175,69554,2018,no,There's Nothing Holdin' Me Back, Shawn Mendes
175,176,69487,2018,no,Malibu, Miley Cyrus
176,177,69431,2018,no,Wasted On You, Travelle
177,178,69355,2018,no,MotorSport, Migos
178,179,69023,2018,no,All the Pretty Girls, KALEO
179,180,68771,2018,no,Out of My Head (feat. Tove Lo and ALMA), Charli XCX
180,181,68156,2018,no,Tell Me You Love Me, Demi Lovato
181,182,68042,2018,no,Let Her Go, Passenger
182,183,67849,2018,no,Wild Thoughts (feat. Rihanna & Bryson Tiller), DJ Khaled
183,184,67439,2018,no,'Till I Collapse, Eminem
184,185,67403,2018,no,Everybody Dies In Their Nightmares, XXXTENTACION
185,186,67204,2018,no,Replay (feat. CIRE), Davai
186,187,66814,2018,no,Cold Water, Conor Maynard
187,188,66717,2018,no,LOVE. FEAT. ZACARI., Kendrick Lamar
188,189,66494,2018,no,BOOM, Tiësto
189,190,66350,2018,no,Rundt neste sving, Rotlaus
190,191,66238,2018,no,You Don't Know Me - Radio Edit, Jax Jones
191,192,66118,2018,no,Burning, Sam Smith
192,193,65943,2018,no,goosebumps, Travis Scott
193,194,65586,2018,no,The Weekend - Funk Wav Remix, SZA
194,195,65266,2018,no,Low Life, Soleima
195,196,65198,2018,no,Disco Demolition 2018 (Stabekk Anthem), J-Dawg
196,197,65058,2018,no,SUBEME LA RADIO (feat. Descemer Bueno & Zion & Lennox), Enrique Iglesias
197,198,64874,2018,no,Save That Shit, Lil Peep
198,199,64839,2018,no,I'm the One (feat. Justin Bieber Quavo Chance the Rapper & Lil Wayne), DJ Khaled
199,200,64713,2018,no,Party on the West Coast (feat. Snoop Dogg), Matoma
