,Rank,Streams,Year,Country,Title,Artist
0,1,1371925,2017,no,Shape of You, Ed Sheeran
1,2,933624,2017,no,Alone, Alan Walker
2,3,862188,2017,no,Castle on the Hill, Ed Sheeran
3,4,838204,2017,no,"I Don’t Wanna Live Forever (Fifty Shades Darker) - From ""Fifty Shades Darker (Original Motion Picture Soundtrack)""", ZAYN
4,5,767308,2017,no,Rocka,e (feat. Sean Paul & Anne-Marie)  
5,6,568677,2017,no,Make Me (Cry), Noah Cyrus
6,7,567663,2017,no,Hear Me Now, Alok
7,8,539268,2017,no,I Feel It Coming, The Weeknd
8,9,536820,2017,no,Call On Me - Ryan Riback Extended Remix, Starley
9,10,501674,2017,no,Lighthouse - Andrelli Remix, Hearts & Colors
10,11,491690,2017,no,Solo Dance, Martin Jensen
11,12,465216,2017,no,Say You Won't Let Go, James Arthur
12,13,441247,2017,no,Move Your Body - Alan Walker Remix, Sia
13,14,433330,2017,no,All Night, The Vamps
14,15,408408,2017,no,Starboy, The Weeknd
15,16,374695,2017,no,En Siste Gang, Staysman & Lazz
16,17,372797,2017,no,What Do You Love, Seeb
17,18,344919,2017,no,Just Hold On, Steve Aoki
18,19,339052,2017,no,Sexual, NEIKED
19,20,337258,2017,no,Closer, The Chainsmokers
20,21,326851,2017,no,Black Beatles, Rae Sremmurd
21,22,317367,2017,no,Don't Wanna Know, Maroon 5
22,23,309979,2017,no,Don't Leave, Snakehips
23,24,304998,2017,no,I Would Like, Zara Larsson
24,25,282810,2017,no,Shed a Light, Robin Schulz
25,26,273047,2017,no,Let Me Love You, DJ Snake
26,27,268777,2017,no,Nervous (The Ooh Song) - Mark McCabe Remix, Gavin James
27,28,268149,2017,no,Side To Side, Ariana Grande
28,29,263609,2017,no,Inside the Lines (feat. Casso), Mike Perry
29,30,257291,2017,no,All We Know, The Chainsmokers
30,31,251211,2017,no,Faded, Alan Walker
31,32,250349,2017,no,24K Magic, Bruno Mars
32,33,244762,2017,no,Mercy, Shawn Mendes
33,34,240768,2017,no,Our City (feat. Emilie Adams), TRXD
34,35,240348,2017,no,Starving, Hailee Steinfeld
35,36,231213,2017,no,Places, Martin Solveig
36,37,229611,2017,no,Heart Won't Forget, Matoma
37,38,227357,2017,no,Bad Things (with Camila Cabello), Machine Gun Kelly
38,39,224934,2017,no,Dynamite (feat. Pretty Sister), Nause
39,40,221273,2017,no,In the Name of Love, Martin Garrix
40,41,221122,2017,no,The Greatest (feat. Kendrick Lamar), Sia
41,42,214153,2017,no,Beast, Tungevaag
42,43,212361,2017,no,Kjærlighet er mer enn forelskelse, LOKE
43,44,206403,2017,no,Tårnet til Carlsen (feat. Simen Agdestein), Staysman & Lazz
44,45,203887,2017,no,Cold Water (feat. Justin Bieber & MØ), Major Lazer
45,46,203502,2017,no,Fake Love, Drake
46,47,203145,2017,no,Sing Me to Sleep, Alan Walker
47,48,193246,2017,no,Starboy - Kygo Remix, The Weeknd
48,49,193055,2017,no,Shout Out to My Ex, Little Mix
49,50,189995,2017,no,My Way, Calvin Harris
50,51,175422,2017,no,Jovial, Freddy Kalas
51,52,161897,2017,no,Heathens, Twenty One Pilots
52,53,160273,2017,no,Hymn for the Weekend - Seeb Remix, Coldplay
53,54,159650,2017,no,Now and Later, Sage The Gemini
54,55,156792,2017,no,Bad and Boujee (feat. Lil Uzi Vert), Migos
55,56,155654,2017,no,Cigarette (feat. Madcon & Julimar Santos), Penthox
56,57,149547,2017,no,One Dance, Drake
57,58,148183,2017,no,Versace 2017, TIX
58,59,147258,2017,no,Cheap Thrills, Sia
59,60,145552,2017,no,Let Me Love You (feat. Chris Crone), SJUR
60,61,144609,2017,no,Millionaire (feat. Nelly) - Alan Walker Remix, Digital Farm Animals
61,62,140692,2017,no,Routine, Alan Walker
62,63,137126,2017,no,Arigato, Julie Bergan
63,64,135538,2017,no,Scars To Your Beautiful, Alessia Cara
64,65,133928,2017,no,Perfect Strangers, Jonas Blue
65,66,132340,2017,no,"How Far I'll Go - From ""Moana""", Alessia Cara
66,67,130736,2017,no,Photograph, Ed Sheeran
67,68,129136,2017,no,Treat You Better, Shawn Mendes
68,69,128134,2017,no,Don't Let Me Down (feat. Daya), The Chainsmokers
69,70,126031,2017,no,"CAN'T STOP THE FEELING! (from DreamWorks Animation's ""TROLLS"")", Justin Timberlake
70,71,122936,2017,no,Love on Me, Galantis
71,72,120998,2017,no,The Ocean (feat. Shy Martin), Mike Perry
72,73,120075,2017,no,Dancing On My Own, Calum Scott
73,74,118299,2017,no,Love Me Now, John Legend
74,75,117521,2017,no,Taped Up Heart (feat. Clara Mae), KREAM
75,76,117270,2017,no,I Got You, Bebe Rexha
76,77,116297,2017,no,We Don't Talk Anymore (feat. Selena Gomez), Charlie Puth
77,78,115371,2017,no,When We Were Young, Adele
78,79,114976,2017,no,Sucker for Pain (with Wiz Khalifa Imagine Dragons Logic & Ty Dolla $ign feat. X Ambassadors), Lil Wayne
79,80,114530,2017,no,False Alarm, Matoma
80,81,113605,2017,no,Juju on That Beat (TZ Anthem), Zay Hilfigerrr
81,82,112742,2017,no,Steady 1234 (feat. Jasmine Thompson & Skizzy Mars), Vice
82,83,110593,2017,no,Alarm, Anne-Marie
83,84,109181,2017,no,STFU, mansionz
84,85,108438,2017,no,Don't Be So Shy - Filatov & Karas Remix, Imany
85,86,106819,2017,no,By Your Side, Jonas Blue
86,87,105635,2017,no,Panda, Desiigner
87,88,105632,2017,no,Alive, Madden
88,89,105612,2017,no,Million Reasons, Lady Gaga
89,90,104760,2017,no,Thinking out Loud, Ed Sheeran
90,91,104151,2017,no,Sex, Cheat Codes
91,92,103224,2017,no,Party Monster, The Weeknd
92,93,100789,2017,no,Only One - Radio Edit, Sigala
93,94,100723,2017,no,Hey Ho, Freddy Kalas
94,95,99437,2017,no,This Town, Niall Horan
95,96,98863,2017,no,Capsize, FRENSHIP
96,97,97557,2017,no,Human, Rag'n'Bone Man
97,98,95586,2017,no,Hello, Adele
98,99,95584,2017,no,The Sound of Silence, Disturbed
99,100,95349,2017,no,The Mack, Nevada
100,101,95001,2017,no,Chantaje (feat. Maluma), Shakira
101,102,94051,2017,no,"I See Fire - From ""The Hobbit - The Desolation Of Smaug""", Ed Sheeran
102,103,93699,2017,no,Here We Go Again, Chris Holsten
103,104,93691,2017,no,I Took A Pill In Ibiza - Seeb Remix, Mike Posner
104,105,93580,2017,no,Målløs, Skei & PT
105,106,93007,2017,no,Sidewalks, The Weeknd
106,107,91580,2017,no,Hurts So Good, Astrid S
107,108,90861,2017,no,Trust Nobody (feat. Selena Gomez & Tory Lanez), Cashmere Cat
108,109,90484,2017,no,Love Yourself, Justin Bieber
109,110,90076,2017,no,Ain't My Fault, Zara Larsson
110,111,89725,2017,no,Feel Da Rush, Freddy Kalas
111,112,89344,2017,no,Deja Vu, J. Cole
112,113,87929,2017,no,Fragile, Kygo
113,114,86504,2017,no,Let It Go, James Bay
114,115,86437,2017,no,Stressed Out, Twenty One Pilots
115,116,86424,2017,no,Lot to Learn, Luke Christopher
116,117,84896,2017,no,Please Don't Go, Joel Adams
117,118,83949,2017,no,The A Team, Ed Sheeran
118,119,83391,2017,no,7 Years, Lukas Graham
119,120,82446,2017,no,Stay (feat. Maty Noyes), Kygo
120,121,82140,2017,no,Lights Out (Too Drunk) [feat. Hayla], DJ Katch
121,122,80652,2017,no,Final Song, MØ
122,123,79606,2017,no,Raging (feat. Kodaline), Kygo
123,124,79602,2017,no,Fast Car, Jonas Blue
124,125,78420,2017,no,This Is What You Came For (feat. Rihanna), Calvin Harris
125,126,78415,2017,no,Berlin, RY X
126,127,77877,2017,no,Lies, Jesper Jenset
127,128,77783,2017,no,Elektrisk, Marcus & Martinus
128,129,77745,2017,no,Sulten 2 (Live på NRK P3), Karpe
129,130,77255,2017,no,Lett å være rebell i kjellerleiligheten din, Karpe
130,131,76751,2017,no,Sunset Lover, Petit Biscuit
131,132,76241,2017,no,Sorry, Justin Bieber
132,133,75255,2017,no,Lay It On Me, Ina Wroldsen
133,134,75124,2017,no,Hymn for the Weekend, Coldplay
134,135,74651,2017,no,Let Me Hold You (Turn Me On), Dante Klein
135,136,74480,2017,no,i hate u i love u (feat. olivia o'brien), Garrett Nash
136,137,74270,2017,no,Me Myself & I, G-Eazy
137,138,74218,2017,no,Kids - Seeb Remix, OneRepublic
138,139,73650,2017,no,All Time Low, Jon Bellion
139,140,73458,2017,no,Girls (feat. Madcon), Marcus & Martinus
140,141,73066,2017,no,Light It Up (feat. Nyla & Fuse ODG) - Remix, Major Lazer
141,142,73021,2017,no,No Lie, Sean Paul
142,143,72332,2017,no,No Money, Galantis
143,144,71818,2017,no,5 fine frøkner, Gabrielle
144,145,71789,2017,no,Send My Love (To Your New Lover), Adele
145,146,71437,2017,no,Take Me To Church, Hozier
146,147,70978,2017,no,September Song, JP Cooper
147,148,70723,2017,no,You & Me, Marc E. Bassy
148,149,70679,2017,no,Work from Home (feat. Ty Dolla $ign), Fifth Harmony
149,150,70482,2017,no,Nostalgi 3Millioner, Tomine Harket
150,151,70272,2017,no,Wake Up Where You Are, State of Sound
151,152,70242,2017,no,The Greatest, Sia
152,153,69749,2017,no,Sangen Du Hater, Katastrofe
153,154,69089,2017,no,Dory 2017, TIX
154,155,68919,2017,no,Sunshine Hits My Face, Freddy Kalas
155,156,68854,2017,no,Broccoli (feat. Lil Yachty), Shelley FKA DRAM
156,157,68491,2017,no,"Lose Yourself - From ""8 Mile"" Soundtrack", Eminem
157,158,67968,2017,no,Hold Back The River, James Bay
158,159,67917,2017,no,Feel Me, Tyga
159,160,67830,2017,no,All I Wanna Do, Martin Jensen
160,161,67430,2017,no,'Till I Collapse, Eminem
161,162,66613,2017,no,Ride, Twenty One Pilots
162,163,66551,2017,no,Savage (feat. Flux Pavilion & MAX), Whethan
163,164,66239,2017,no,Let Her Go, Passenger
164,165,66032,2017,no,Stole the Show, Kygo
165,166,65891,2017,no,Jealous, Labrinth
166,167,65869,2017,no,Some Kind Of Drug (feat. Marc E. Bassy), G-Eazy
167,168,65610,2017,no,We Don't Have To Take Our Clothes Off, Ella Eyre
168,169,65579,2017,no,Bare så du vett det, Stavangerkameratene
169,170,65324,2017,no,This One's for You (feat. Zara Larsson) (Official Song UEFA EURO 2016), David Guetta
170,171,65222,2017,no,Gunerius, Karpe
171,172,63815,2017,no,Into You, Ariana Grande
172,173,63643,2017,no,See You Again (feat. Charlie Puth), Wiz Khalifa
173,174,63220,2017,no,Pinne for landet, Freddy Kalas
174,175,62746,2017,no,Famous, Kanye West
175,176,62476,2017,no,Cool Girl, Tove Lo
176,177,62474,2017,no,Gangsta Walk (feat. Nate Dogg), SNBRN
177,178,62404,2017,no,One Step At A Time (feat. Natalola), Bearson
178,179,62126,2017,no,Gullalderen 2017, TIX
179,180,61949,2017,no,Move Your Body - Single Mix, Sia
180,181,61408,2017,no,Bounce Back, Big Sean
181,182,61297,2017,no,Visceral, Bernhoft
182,183,61089,2017,no,Summer Air, ItaloBrothers
183,184,60958,2017,no,Breathe, Seeb
184,185,60294,2017,no,It's Gotta Be You, Isaiah Firebrace
185,186,60240,2017,no,Weak, AJR
186,187,60063,2017,no,For Evigt, Volbeat
187,188,59777,2017,no,Don't Let Go, Lila
188,189,59694,2017,no,Easy Love, Dunisco
189,190,59574,2017,no,Carry Me (feat. Julia Michaels), Kygo
190,191,59413,2017,no,Chill Bill (feat. J. Davi$ & Spooks), Rob $tone
191,192,59196,2017,no,PILLOWTALK, ZAYN
192,193,59083,2017,no,Everglow, Coldplay
193,194,59060,2017,no,Water Under the Bridge, Adele
194,195,58750,2017,no,Stay With Me, Sam Smith
195,196,58676,2017,no,Vestlandet, Vilde og Anna
196,197,58665,2017,no,Firestone, Kygo
197,198,58226,2017,no,Caroline, Aminé
198,199,58191,2017,no,in my miNd, Maty Noyes
199,200,57754,2017,no,Party (feat. Usher & Gucci Mane), Chris Brown
